{
  "$schema": "https://raw.githubusercontent.com/justeattakeaway/httpclient-interception/main/src/HttpClientInterception/Bundles/http-request-bundle-schema.json",
  "id": "content-as-html-string-bundle",
  "comment": "An HTTP request bundle with content as a string.",
  "version": 1,
  "items": [
    {
      "id": "html",
      "comment": "An HTTP request that returns an HTML string.",
      "uri": "https://www.just-eat.co.uk/",
      "contentString": "<html><head><title>Just Eat</title></head></html>"
    }
  ]
}
