{
  "$schema": "https://raw.githubusercontent.com/justeattakeaway/httpclient-interception/main/src/HttpClientInterception/Bundles/http-request-bundle-schema.json",
  "id": "templated-json-bundle",
  "comment": "An HTTP request bundle that uses templating for JSON.",
  "version": 1,
  "items": [
    {
      "comment": "An HTTP request for a JSON response that uses templating.",
      "uri": "https://api.github.com/orgs/${CompanyName}",
      "contentFormat": "json",
      "contentJson": {
        "id": 1516790,
        "login": "justeattakeaway",
        "url": "https://api.github.com/orgs/${CompanyName}",
        "avatar_url": "${AvatarUrl}",
        "name": "${Name}",
        "blog": "${BlogUrl}"
      },
      "templateValues": {
        "CompanyName": "justeattakeaway",
        "Name": "JustEatTakeaway"
      }
    },
    {
      "comment": "An HTTP request for a JSON response that uses templating.",
      "uri": "https://api.github.com/orgs/${CompanyName}/repos",
      "contentFormat": "json",
      "contentJson": [
        {
          "id": 123456,
          "name": "${RepoName}",
          "full_name": "${CompanyName}/${RepoName}",
          "private": false,
          "owner": {
            "login": "${CompanyName}",
            "id": 1516790
          }
        }
      ],
      "templateValues": {
        "CompanyName": "justeattakeaway",
        "RepoName": "httpclient-interception"
      }
    }
  ]
}
