{
  "$schema": "https://raw.githubusercontent.com/justeattakeaway/httpclient-interception/main/src/HttpClientInterception/Bundles/http-request-bundle-schema.json",
  "id": "content-as-base64-string-bundle",
  "comment": "An HTTP request bundle with content as a Base64 string.",
  "version": 1,
  "items": [
    {
      "id": "html",
      "comment": "An HTTP request that returns a Base64-encoded HTML string.",
      "uri": "https://www.just-eat.co.uk/",
      "contentFormat": "base64",
      "contentString": "PGh0bWw+PGhlYWQ+PHRpdGxlPkp1c3QgRWF0PC90aXRsZT48L2hlYWQ+PC9odG1sPg=="
    }
  ]
}
