{
  "$schema": "https://raw.githubusercontent.com/justeattakeaway/httpclient-interception/main/src/HttpClientInterception/Bundles/http-request-bundle-schema.json",
  "id": "content-as-json-array-bundle",
  "comment": "An HTTP request bundle with content as a JSON array.",
  "version": 1,
  "items": [
    {
      "comment": "An HTTP request that returns a JSON array.",
      "uri": "https://api.github.com/orgs/justeattakeaway/repos",
      "contentFormat": "json",
      "contentJson": [
        "httpclient-interception"
      ]
    }
  ]
}
